{
  "level": "idea_development",
  "language": "es-CR",
  "topic_es": "La alimentación saludable y el rendimiento escolar",
  "text_type": "expositivo",
  "difficulty": "medium",
  "evaluation": {
    "scale": {
      "max": 4,
      "min": 0
    },
    "evaluator": "human",
    "rubric_id": "MEP-RUBRICA-PE-2026",
    "parameters": [
      {
        "criterion": "EE03",
        "rubric_ref": "MEP-RUBRICA-PE-2026#EE03",
        "applicability": "scored"
      },
      {
        "criterion": "EE04",
        "rubric_ref": "MEP-RUBRICA-PE-2026#EE04",
        "applicability": "scored"
      }
    ],
    "counting_rule": "identical_repetition_counts_once",
    "rubric_sha256": "460a931a4e2c37d7f7250607f41627391dbed966ff2d9b0ca43d7002a635187d"
  },
  "provenance": {
    "sources": [
      {
        "role": "rubric",
        "document_id": "MEP-RUBRICA-PE-2026",
        "file_sha256": "460a931a4e2c37d7f7250607f41627391dbed966ff2d9b0ca43d7002a635187d"
      },
      {
        "role": "task_model",
        "document_id": "MEP-PRUEBA-PE-2026-MODELO",
        "file_sha256": "7e657f24295b8fdc63bcdc25217e31bb69ef5d2cdf7d1d148979fe641cc00928"
      },
      {
        "role": "topic_model",
        "document_id": "GUIA-PE-2026",
        "file_sha256": "2b42d432a0eca2bc3f363823db5941381abea806f511af8573a3da46f092b265"
      }
    ],
    "authored_by": "llm_draft_human_reviewed",
    "baseline_version": "PNE2026-SUM-v1.0",
    "curriculum_records": [
      {
        "assertion_id": "PNE2026-PRI-ESP-PE-B2-A3",
        "workbook_code": "EE03"
      },
      {
        "assertion_id": "PNE2026-PRI-ESP-PE-B3-A4",
        "workbook_code": "EE04"
      }
    ]
  },
  "deliverable": {
    "max": 1,
    "min": 1,
    "unit": "paragraphs",
    "evidence_mode": "typed",
    "description_es": "Un solo párrafo de introducción que contenga una idea principal y al menos dos ideas complementarias, relacionado con la situación comunicativa."
  },
  "exercise_id": "PE-L2-alimentacion-saludable-rendimiento-19a72a",
  "exercise_type": "introduction_paragraph",
  "schema_version": "1.0",
  "instructions_es": [
    "Leé la situación comunicativa y el tema.",
    "Pensá una idea principal que presente el tema.",
    "Agregá al menos dos ideas complementarias relacionadas con la situación.",
    "Escribí un solo párrafo de introducción con una idea principal que presente el tema y al menos dos ideas complementarias relacionadas con la situación comunicativa.",
    "Revisá que el párrafo sea coherente y use conectores."
  ],
  "target_criteria": [
    "EE03",
    "EE04"
  ],
  "suggested_ideas_es": [
    "Beneficios de una alimentación balanceada para la concentración y la memoria",
    "Consecuencias de saltarse comidas o comer mucha comida chatarra",
    "Acciones sencillas que podés hacer en la escuela y en casa para comer mejor",
    "El papel de la familia y la escuela para promover hábitos alimentarios saludables"
  ],
  "communicative_situation_es": "Vos formás parte del comité de salud de tu escuela y debés redactar la introducción de un folleto que se entregará en la feria de la salud escolar. El folleto va dirigido a estudiantes, docentes y familias para informar y explicar por qué una buena alimentación ayuda a aprender mejor y convivir sanamente."
}
